{
  "id": "curriculum.info1.v1",
  "type": "curriculum",
  "schema_version": "1.0",
  "stage": "high_school",
  "subject": "Information I",
  "locale": "ja",
  "status": "draft",
  "review_status": "needs_human_review",
  "scope_version": "0.2",
  "tracking_issue": 59,
  "source_refs": [
    "src.mext.highschool.curriculum2018.v1",
    "src.mext.information.commentary2018.v1"
  ],
  "notes": [
    "This is an original project decomposition for planning and coverage review.",
    "Lesson count, order, titles, and assessment design are project decisions, not MEXT-prescribed requirements.",
    "Unit A objectives are draft project interpretations of Information I content (1), using the Course of Study PDF pages 191-192 and Information commentary PDF pages 30-34 as scope locators rather than official objective wording.",
    "No official textbook, final curriculum alignment, approval, or publication claim is made."
  ],
  "units": [
    {
      "id": "unit.info1.society.v1",
      "area": "mext.info1.1",
      "title": "Information Society and Problem Solving",
      "status": "draft",
      "source_locator": {
        "normative": "High School Course of Study, Information I content (1), PDF pages 191-192",
        "commentary": "Information commentary, Information I content (1), PDF pages 30-34"
      },
      "unit_outcome": "Analyze an information-related problem, identify responsibilities and constraints, compare alternatives, and evaluate a solution with evidence.",
      "lessons": [
        {
          "order": "A1",
          "lesson_id": "lesson.info1.society.information.media.v1",
          "title": "Information and Media",
          "status": "draft",
          "learning_objectives": [
            {
              "id": "obj.info1.society.information.media.001.v1",
              "statement": "Distinguish data, information, and media in a concrete situation.",
              "expected_evidence": "analysis",
              "label": "A1.O1"
            },
            {
              "id": "obj.info1.society.information.media.002.v1",
              "statement": "Explain how a medium changes what can be recorded, transmitted, or interpreted.",
              "expected_evidence": "explanation",
              "label": "A1.O2"
            },
            {
              "id": "obj.info1.society.information.media.003.v1",
              "statement": "Identify an information-related problem from observations and evidence.",
              "expected_evidence": "identification",
              "label": "A1.O3"
            }
          ],
          "prerequisites": [
            "Everyday experience receiving and sharing information."
          ],
          "key_concepts": [
            "data",
            "information",
            "media",
            "representation",
            "problem discovery"
          ],
          "assessment_intent": "Classify examples and justify a problem statement using observable evidence.",
          "depends_on": [],
          "source_refs": [
            "src.mext.highschool.curriculum2018.v1",
            "src.mext.information.commentary2018.v1"
          ],
          "instructional_time": {
            "class_periods_50_min": [
              1,
              1
            ],
            "self_study_minutes": [
              35,
              60
            ],
            "is_multi_session_project": false
          },
          "assessment_coverage": [
            {
              "objective_ref": "obj.info1.society.information.media.001.v1",
              "requirement": "two_items_or_one_item_plus_performance_criterion",
              "status": "complete",
              "assessment_item_refs": [
                "prob.info1.society.information.media.001.v1",
                "prob.info1.society.information.media.004.v1"
              ],
              "performance_criterion_refs": []
            },
            {
              "objective_ref": "obj.info1.society.information.media.002.v1",
              "requirement": "two_items_or_one_item_plus_performance_criterion",
              "status": "complete",
              "assessment_item_refs": [
                "prob.info1.society.information.media.002.v1",
                "prob.info1.society.information.media.004.v1"
              ],
              "performance_criterion_refs": []
            },
            {
              "objective_ref": "obj.info1.society.information.media.003.v1",
              "requirement": "two_items_or_one_item_plus_performance_criterion",
              "status": "complete",
              "assessment_item_refs": [
                "prob.info1.society.information.media.003.v1",
                "prob.info1.society.information.media.004.v1"
              ],
              "performance_criterion_refs": []
            }
          ]
        },
        {
          "order": "A2",
          "lesson_id": "lesson.info1.society.source.evaluation.v1",
          "title": "Reliability and Source Evaluation",
          "status": "draft",
          "learning_objectives": [
            {
              "id": "obj.info1.society.source.evaluation.001.v1",
              "statement": "Separate a claim from the evidence offered for it.",
              "expected_evidence": "analysis",
              "label": "A2.O1"
            },
            {
              "id": "obj.info1.society.source.evaluation.002.v1",
              "statement": "Evaluate source relevance, currency, authorship, and corroboration.",
              "expected_evidence": "evaluation",
              "label": "A2.O2"
            },
            {
              "id": "obj.info1.society.source.evaluation.003.v1",
              "statement": "Record uncertainty instead of presenting an unsupported conclusion.",
              "expected_evidence": "documentation",
              "label": "A2.O3"
            }
          ],
          "prerequisites": [
            "A1: Information and Media."
          ],
          "key_concepts": [
            "claim",
            "evidence",
            "source",
            "reliability",
            "uncertainty"
          ],
          "assessment_intent": "Compare candidate sources and explain which evidence can and cannot support a claim.",
          "depends_on": [
            "lesson.info1.society.information.media.v1"
          ],
          "source_refs": [
            "src.mext.highschool.curriculum2018.v1",
            "src.mext.information.commentary2018.v1"
          ],
          "instructional_time": {
            "class_periods_50_min": [
              1,
              2
            ],
            "self_study_minutes": [
              45,
              90
            ],
            "is_multi_session_project": false
          },
          "assessment_coverage": [
            {
              "objective_ref": "obj.info1.society.source.evaluation.001.v1",
              "requirement": "two_items_or_one_item_plus_performance_criterion",
              "status": "complete",
              "assessment_item_refs": [
                "prob.info1.society.source.evaluation.001.v1",
                "prob.info1.society.source.evaluation.004.v1"
              ],
              "performance_criterion_refs": []
            },
            {
              "objective_ref": "obj.info1.society.source.evaluation.002.v1",
              "requirement": "two_items_or_one_item_plus_performance_criterion",
              "status": "complete",
              "assessment_item_refs": [
                "prob.info1.society.source.evaluation.002.v1",
                "prob.info1.society.source.evaluation.004.v1"
              ],
              "performance_criterion_refs": []
            },
            {
              "objective_ref": "obj.info1.society.source.evaluation.003.v1",
              "requirement": "two_items_or_one_item_plus_performance_criterion",
              "status": "complete",
              "assessment_item_refs": [
                "prob.info1.society.source.evaluation.003.v1",
                "prob.info1.society.source.evaluation.004.v1"
              ],
              "performance_criterion_refs": []
            }
          ]
        },
        {
          "order": "A3",
          "lesson_id": "lesson.info1.society.rights.responsibility.v1",
          "title": "Rights, Responsibility, Privacy, and Risk",
          "status": "draft",
          "learning_objectives": [
            {
              "id": "obj.info1.society.rights.responsibility.001.v1",
              "statement": "Identify stakeholders, information flows, and potential harms in a scenario.",
              "expected_evidence": "identification",
              "label": "A3.O1"
            },
            {
              "id": "obj.info1.society.rights.responsibility.002.v1",
              "statement": "Distinguish personal responsibility, social norms, and source-backed legal constraints.",
              "expected_evidence": "analysis",
              "label": "A3.O2"
            },
            {
              "id": "obj.info1.society.rights.responsibility.003.v1",
              "statement": "Explain why information security matters and propose a risk-reducing action with trade-offs.",
              "expected_evidence": "evaluation",
              "label": "A3.O3"
            }
          ],
          "prerequisites": [
            "A1: Information and Media.",
            "A2: Reliability and Source Evaluation."
          ],
          "key_concepts": [
            "privacy",
            "responsibility",
            "information ethics",
            "information security",
            "risk",
            "stakeholder"
          ],
          "assessment_intent": "Analyze a fictional scenario, explain the importance of information security, and avoid unsupported legal claims.",
          "depends_on": [
            "lesson.info1.society.information.media.v1",
            "lesson.info1.society.source.evaluation.v1"
          ],
          "source_refs": [
            "src.mext.highschool.curriculum2018.v1",